context,response,dim0,dim1,label
それでも、やっぱり上司という立場があるからね…遠慮する人もいると思うよ。,ちなみに、お酒とかの宅配サービスも試しに使ってみるので、気にならないくらい楽しくなると思います！,-6.87910742,7.58657849,18
それは面白そうだね。後で感想を聞かせてほしいな。,当日一緒に感想を共有しませんか？👀,-10.14803364,7.12277679,2
お疲れ様！,今週末、オンライン飲み会を企画しているのですが先輩もどうですか？,9.69013501,-3.63488772,15
すごく楽しそうじゃん,今回はお酒とかおつまみを届けてくれるサービスも使ってみようと思ってるので盛り上がると思います！,3.30684819,-4.18286288,12
へぇ、それ良さそう！準備の手間も省けそうだしね,ですよね！先輩も参加して一緒に飲みませんか？,4.73056528,-11.08888684,17
最近飲んでないし、飲みたいなぁ。。。,それじゃあ、参加ってことで良いですか？,-11.99440337,4.72748892,40
人数とか誰が来るかとかは大体決まってるの？,佐藤、鈴木、高橋、渡辺、小林と自分の6人です！,1.03531543,6.33415746,4
他には誰か来ないの？,今のところは考えてないですね。あとは先輩に今こうやって声をかけているぐらいです。,1.58921679,4.00623761,42
じゃあ、清水の同期しかいないってことなんだな？,そうなりますね。,-3.63950484,7.23460929,37
ちょっとそれは気まずいかなぁ。。。笑,えー、なんでですか？,1.54284808,-5.11263504,31
だってみんな同世代なのに、俺だけ上なんだよ？,まあ、そうですけど…でも、大丈夫ですよ！,-2.30512916,6.72973068,37
何が大丈夫なのよ笑。浮かないか不安だよ,いつも仲良くしてもらってるじゃないですか！心配しすぎですよ！（笑）,3.57483683,-9.62844552,41
そうだけど、なんかお堅い会社の飲み会みたいになりそうでさ。。。,そんなことないですよ！絶対大丈夫です！,-9.04067576,7.94806895,1
絶対的な自信があるんだね笑,あります！先輩が浮くと思ってるならみんな先輩に来てほしいなんて言いませんよ！,-11.25513956,8.13227936,26
ありがたいことだけど、たまには同期の絆を感じた方がいいんだよ？,今回は先輩も交えて楽しく飲みたいね～ってみんなで話してたんですけど…,-5.90881318,8.41107049,5
まーでも今回は遠慮して、同期だけの楽しんだ様子を後から聞こうかなー,そこは後輩たちの要望を受け入れてくださいよ～,0.36018793,-6.90129887,38
受けたいけども、今回はね。みんなのために身を引くよ,いやいや、先輩のお話も色々聞きたいんです！楽しくお話ししましょうよ～,-6.66192059,3.75344796,50
今度ランチとかで楽しく話してあげるからさー,飲み会の席だからこそ色々話せるんじゃないですか～,-5.00754891,5.98223424,49
飲み会だと上司としての体裁を守れなくなっちゃうじゃない,だからいいんじゃないですか～。上司としてじゃなくて湯川さんとして参加してほしいんですよ。,1.48316502,-11.63077922,19
プライベートじゃなくたって、会社の飲み会で一緒に飲めるしさー,親睦をさらに深めたいんです！お願いします！,-7.66687317,8.88299467,49
